name,contact_name,areas,suburbs,phone,email,website,notes,source_url
Central Adelaide Driving (CADS),,['Adelaide CBD'],"['Adelaide CBD', 'Inner city (start/finish in CBD)']",,,https://centraladelaide.com.au/,Lessons start/finish in Adelaide CBD; pricing listed on site (90 min).,https://centraladelaide.com.au/
RAA Driving School,,"['Adelaide CBD', 'Adelaide Metro']",['Adelaide Metro (pick-up by instructor)'],8202 4444,,https://www.raa.com.au/motor/driving-school/driving-lessons,SA's largest driving school; CBT&A (logbook) + VORT prep; member/non-member pricing shown online.,https://www.raa.com.au/motor/driving-school/driving-lessons
Adelaide School of Driving (ASOD),,"['Adelaide CBD', 'Adelaide Metro']",['Adelaide (metro)'],(08) 7324 4992,,https://www.adelaideschoolofdriving.com.au/,Adelaide-based driving school; phone listed on site for bookings.,https://www.adelaideschoolofdriving.com.au/
Headrite Driving School,,"['Adelaide CBD', 'Adelaide Metro']",['Adelaide (metro)'],,,https://headritedrivingschool.com.au/,Qualified instructors; offers CBT&A or VORT; manual and auto (per site).,https://headritedrivingschool.com.au/
Adelaide Driver Training Academy SA,,"['Adelaide CBD', 'Adelaide Metro']",['Adelaide (metro)'],,,https://adelaidedrivertrainingacademysa.com.au/,Offers automatic/manual; CBT&A and VORT (per site).,https://adelaidedrivertrainingacademysa.com.au/
Learn To Drive Adelaide,,"['Adelaide CBD', 'Adelaide Metro']",['Adelaide (metro)'],,,https://adldrivertraining.com.au/,Driving lessons + VORT preparation; accredited; info on site.,https://adldrivertraining.com.au/
Instinctive Driving,,"['Adelaide CBD', 'Adelaide Metro']",['Metropolitan Adelaide'],,,https://www.instinctivedriving.com.au/,Services metropolitan Adelaide; office hours and reviews shown on site.,https://www.instinctivedriving.com.au/
EzLicence (Adelaide CBD bookings marketplace),,['Adelaide CBD'],['Adelaide CBD'],,,https://www.ezlicence.com.au/driving-instructors/sa/adelaide-cbd,Booking platform listing instructors servicing Adelaide CBD (names/ratings vary).,https://www.ezlicence.com.au/driving-instructors/sa/adelaide-cbd
